region,lat,lng
"Paso Robles, Central Coast, California, US",nan,nan
"Vista Flores, Mendoza Province, Argentina",nan,nan
"Douro, Portugal",41.17004195,-7.304749811735755
"Toscana, Tuscany, Italy",43.7215969,10.3969338
"Campania, Southern Italy, Italy",nan,nan
"Livermore Valley, Central Coast, California, US",nan,nan
"Napa Valley, Napa, California, US",38.5764234,-122.570995
"Crémant de Bordeaux, Bordeaux, France",nan,nan
"Burgenland, Austria",47.5000001,16.4166666
"Martinborough, New Zealand",-41.2183252,175.4594856
"Russian River Valley, Sonoma, California, US",nan,nan
"Mendoza, Mendoza Province, Argentina",-37.3895633,-68.9187537
"Saint-Émilion, Bordeaux, France",44.8448069,-0.7952435
"Dão, Portugal",39.9375585,-7.8638768
"Salento, Southern Italy, Italy",nan,nan
"Jidvei, Romania",46.2224475,24.1106119
"Lisboa, Portugal",38.7077507,-9.1365919
"Arroyo Grande Valley, Central Coast, California, US",nan,nan
"Volnay, Burgundy, France",nan,nan
"Stellenbosch, South Africa",-33.934444,18.869167
"Pessac-Léognan, Bordeaux, France",nan,nan
"Santa Lucia Highlands, Central Coast, California, US",nan,nan
"Swartland, South Africa",-33.29356,18.599382501779992
"South Eastern Australia, Australia Other, Australia",nan,nan
"Sicilia, Sicily & Sardinia, Italy",nan,nan
"Barsac, Bordeaux, France",44.8176672,-0.5701552
"Sta. Rita Hills, Central Coast, California, US",nan,nan
"Alexander Valley, Sonoma, California, US",38.6712308,-122.8278697
"Walla Walla Valley (WA), Columbia Valley, Washington, US",nan,nan
"Chalk Hill, Sonoma, California, US",38.6037982,-122.7772125
"North Coast, North Coast, California, US",nan,nan
"Mendocino County, Mendocino County, California, US",39.3076744,-123.7994591
"Priorat, Catalonia, Spain",41.2137983,0.811623628426715
"Alsace, Alsace, France",50.6998614,3.1610799
"Nemea, Greece",37.8209952,22.6613055
"Barbaresco, Piedmont, Italy",nan,nan
"Madiran, Southwest France, France",nan,nan
"Port, Portugal",19.9937037,-72.6408359
"Stags Leap District, Napa, California, US",nan,nan
"Soave, Veneto, Italy",45.4202303,11.247722
"Barolo, Piedmont, Italy",nan,nan
"Anderson Valley, Mendocino County, California, US",39.0600021,-123.4305338
"Columbia Valley (WA), Columbia Valley, Washington, US",47.559746849999996,-122.29271151155538
"Cava, Catalonia, Spain",42.31658175,1.6111496867672197
"Texas, Texas, US",31.3459637,-93.85087566372492
"Marlborough, New Zealand",-41.47447475,173.8330262577606
"$10,Buy Now",nan,nan
"Vino Spumante, Italy Other, Italy",nan,nan
"Cahors, Southwest France, France",nan,nan
"Saint-Aubin, Burgundy, France",nan,nan
"Beira Interior, Portugal",nan,nan
"Bordeaux, Bordeaux, France",44.841225,-0.5800364
"Cortona, Tuscany, Italy",43.2752976,11.9850623
"Umbria, Central Italy, Italy",nan,nan
"Rioja, Northern Spain, Spain",nan,nan
"Atlas Peak, Napa, California, US",38.4507431,-122.2627529
"Maremma, Tuscany, Italy",42.6303496,11.109500030899984
"Finger Lakes, Finger Lakes, New York, US",42.6399473,-75.9776465
"Champagne, Champagne, France",48.3260178,5.6962829
"Weinviertel, Austria",48.465336699999995,16.28614802566092
"Amarone della Valpolicella Classico, Veneto, Italy",nan,nan
"Missouri, Missouri, US",39.11857785,-94.60040535467422
"Yakima Valley, Columbia Valley, Washington, US",nan,nan
"Monterey County, Central Coast, California, US",nan,nan
"Lake County, Lake County, California, US",34.2440587,-116.91018
"Chablis, Burgundy, France",nan,nan
"Traisental, Austria",47.966651,15.5593148
"Nebbiolo d'Alba, Piedmont, Italy",nan,nan
"Côtes de Provence, Provence, France",43.4499127,6.656105192180794
"Châteauneuf-du-Pape, Rhône Valley, France",nan,nan
"Santa Maria Valley, Central Coast, California, US",nan,nan
"Valencia, Levante, Spain",38.5377163,-0.12495685682197755
"Côtes du Rhône, Rhône Valley, France",nan,nan
"Alto Adige, Northeastern Italy, Italy",nan,nan
"Chalone, Central Coast, California, US",nan,nan
"Alentejo, Portugal",38.49104545,-8.02734298589458
"Howell Mountain, Napa, California, US",38.5812999,-122.4510974
"Dry Creek Valley, Sonoma, California, US",nan,nan
"Franciacorta, Lombardy, Italy",45.5893961,10.0774492
"Pfalz, Germany",51.90263795,10.424768531182796
"Sonoma Coast, Sonoma, California, US",38.4243975,-123.0883292433611
"Durbanville, South Africa",-33.8402778,18.6494444
"Sancerre, Loire Valley, France",47.3307251,2.8390333
"Pommard, Burgundy, France",nan,nan
"Valpolicella Classico Superiore, Veneto, Italy",nan,nan
"Galilee, Israel",33.2518247,35.6035422
"Mâcon-Villages, Burgundy, France",nan,nan
"Trento, Northeastern Italy, Italy",nan,nan
"Romania, Romania",45.9852129,24.6859225
"Lodi, Central Valley, California, US",nan,nan
"Red Mountain, Columbia Valley, Washington, US",nan,nan
"Willamette Valley, Willamette Valley, Oregon, US",nan,nan
"Etna, Sicily & Sardinia, Italy",nan,nan
"Sainte-Foy Bordeaux, Bordeaux, France",nan,nan
"Nahe, Germany",53.7942267,10.13793
"Luján de Cuyo, Mendoza Province, Argentina",-34.5009474,-58.7449228
"Cigales, Northern Spain, Spain",nan,nan
"Franken, Germany",50.90197445,12.613723504582538
"Côtes du Lot, Southwest France, France",nan,nan
"California, California Other, California, US",nan,nan
"Vino de la Tierra de Castilla y León, Northern Spain, Spain",nan,nan
"Pomerol, Bordeaux, France",44.8924929,-0.5179616
"Pays d'Oc, Languedoc-Roussillon, France",nan,nan
"New South Wales, New South Wales, Australia",-33.8737539,151.2095867
"Colchagua Valley, Chile",-34.6357194,-71.1842225
"Wagram-Donauland, Austria",48.4022568,15.915696351635837
"Bordeaux Blanc, Bordeaux, France",44.8899422,-0.503907
"Vin Mousseux, France Other, France",nan,nan
"Rutherford, Napa, California, US",38.458521,-122.422479
"Ancient Lakes, Columbia Valley, Washington, US",nan,nan
"Pouilly-Fumé, Loire Valley, France",nan,nan
"Red Hills, Lake County, California, US",33.6825322,-117.6344959
"McMinnville, Willamette Valley, Oregon, US",nan,nan
"Santa Barbara County, Central Coast, California, US",nan,nan
"Santa Clara Valley, Central Coast, California, US",nan,nan
"McLaren Vale, South Australia, Australia",-35.2172617,138.5416998
"La Consulta, Mendoza Province, Argentina",-35.8145006,-61.8948752
"Hungary, Hungary",47.1817585,19.5060937
"Mendocino, Mendocino County, California, US",39.3076744,-123.7994591
"Sonoma Valley, Sonoma, California, US",38.283177800000004,-122.45782658220767
"Muscat de Beaumes de Venise, Rhône Valley, France",nan,nan
"Valpolicella, Veneto, Italy",45.5296706,10.9400217
"Kremstal, Austria",47.9263917,14.0780469
"Prosecco di Valdobbiadene, Veneto, Italy",45.8734603,12.0275133
"Sonoma County, Sonoma, California, US",38.2866265,-122.43412263425901
"",nan,nan
"Kamptal, Austria",48.534843,15.6922503
"Dundee Hills, Willamette Valley, Oregon, US",nan,nan
"Potter Valley, Mendocino County, California, US",39.315214600000004,-123.11246387038575
"Brunello di Montalcino, Tuscany, Italy",43.0573788,11.490614
"France, France Other, France",nan,nan
"$12,Buy Now",nan,nan
"Virginia, Virginia, US",47.52326,-92.536571
"Bordeaux Supérieur, Bordeaux, France",nan,nan
"Vin de France, France Other, France",nan,nan
"Mâcon-Verze, Burgundy, France",nan,nan
"Puget Sound, Washington Other, Washington, US",nan,nan
"Paso Robles Willow Creek District, Central Coast, California, US",nan,nan
"Mount Veeder, Napa, California, US",38.3793566,-122.4477575
"Tejo, Portugal",38.7617281,-9.0936239
"Bolgheri Superiore, Tuscany, Italy",nan,nan
"Valdobbiadene Prosecco Superiore, Veneto, Italy",nan,nan
"Santa Cruz Mountains, Central Coast, California, US",nan,nan
"Wachau, Austria",48.3275563,15.41162578949626
"Sierra Foothills, Sierra Foothills, California, US",nan,nan
"Vienna, Austria",48.2083537,16.3725042
"Custoza Superiore, Veneto, Italy",nan,nan
"Alentejano, Portugal",37.6501278,-8.226053321081615
"Coombsville, Napa, California, US",38.2974731,-122.2695614
"Great Southern, Western Australia, Australia",-34.9466108,117.97045914131579
"Coteaux d'Aix-en-Provence, Provence, France",43.6431572,5.153573338614567
"Margaret River, Western Australia, Australia",-33.9531776,115.0769369
"Sauternes, Bordeaux, France",44.8544783,-0.4896867
"Rattlesnake Hills, Columbia Valley, Washington, US",nan,nan
"Franschhoek, South Africa",-33.909167,19.119444
"Terre Siciliane, Sicily & Sardinia, Italy",nan,nan
"Languedoc-Cabrières, Languedoc-Roussillon, France",nan,nan
"Haut-Médoc, Bordeaux, France",44.8735122,-0.636612
"Paso Robles Highlands District, Central Coast, California, US",nan,nan
"Castel del Monte, Southern Italy, Italy",nan,nan
"Bourgogne, Burgundy, France",47.3133052,5.068862575081764
"Hawke's Bay, New Zealand",-39.52565115,176.7611456576855
"Val di Neto, Southern Italy, Italy",nan,nan
"Crémant d'Alsace, Alsace, France",48.243850949999995,7.391879050000001
"Amyndeon, Greece",nan,nan
"Delle Venezie, Northeastern Italy, Italy",nan,nan
"Mosel, Germany",50.3659752,7.5858251
"Eola-Amity Hills, Willamette Valley, Oregon, US",nan,nan
"Friuli Grave, Northeastern Italy, Italy",nan,nan
"Robertson, South Africa",-33.802222,19.883611
"Leelanau Peninsula, Michigan, US",nan,nan
"Arroyo Seco, Central Coast, California, US",nan,nan
"Vernaccia di San Gimignano, Tuscany, Italy",43.4680172,11.0419989
"Rheingau, Germany",50.133927650000004,8.070181122509714
"Chianti Superiore, Tuscany, Italy",nan,nan
"Barossa, South Australia, Australia",-34.61341495,138.93854551693641
"Ribera del Duero, Northern Spain, Spain",nan,nan
"Valpolicella Superiore, Veneto, Italy",nan,nan
"Oregon, Oregon Other, Oregon, US",nan,nan
"Umpqua Valley, Southern Oregon, Oregon, US",nan,nan
"Graves, Bordeaux, France",44.7760791,-0.6523275464905922
"Aconcagua Valley, Chile",nan,nan
"Vermentino di Sardegna, Sicily & Sardinia, Italy",nan,nan
"Rueda, Northern Spain, Spain",nan,nan
"Sonoma Mountain, Sonoma, California, US",38.3229698,-122.5749837
"Niederösterreich, Austria",48.2817813,15.7632457
"Beaune, Burgundy, France",47.2359496,4.9773824
"Barbera d'Asti, Piedmont, Italy",nan,nan
"North Fork of Long Island, Long Island, New York, US",nan,nan
"Aglianico del Vulture, Southern Italy, Italy",nan,nan
"Rías Baixas, Galicia, Spain",42.4024738,-8.8083575
"Gigondas, Rhône Valley, France",nan,nan
"Maipo Valley, Chile",nan,nan
"Mosel-Saar-Ruwer, Germany",nan,nan
"Rosso Piceno Superiore, Central Italy, Italy",nan,nan
"Rapel Valley, Chile",nan,nan
"Paarl, South Africa",-33.741667,18.975
"Primitivo di Manduria, Southern Italy, Italy",nan,nan
"Curicó Valley, Chile",nan,nan
"Walla Walla Valley (OR), Oregon Other, Oregon, US",nan,nan
"Santorini, Greece",36.4071112,25.456663652707153
"Veronese, Veneto, Italy",45.6059385,10.7951325
"Moulin-à-Vent, Beaujolais, France",nan,nan
"Horse Heaven Hills, Columbia Valley, Washington, US",nan,nan
"Murgia, Southern Italy, Italy",nan,nan
"Shenandoah Valley (CA), Sierra Foothills, California, US",nan,nan
"Dunnigan Hills, Central Valley, California, US",nan,nan
"San Juan, Other, Argentina",38.4385793,-109.3702555
"Rheinhessen, Germany",49.9045181,8.2711082
"Mercurey, Burgundy, France",nan,nan
"Chianti Classico, Tuscany, Italy",43.3932476,11.3086645
"Amador County, Sierra Foothills, California, US",nan,nan
"Navarra, Northern Spain, Spain",nan,nan
"Temecula Valley, South Coast, California, US",nan,nan
"South Australia, South Australia, Australia",-35.29648635,149.12951134999997
"Redwood Valley, Mendocino County, California, US",39.2654449,-123.204449
"Vinho Verde, Portugal",41.06749979999999,-8.23726943712506
"Yamhill-Carlton, Willamette Valley, Oregon, US",nan,nan
"Vin Santo del Chianti Classico, Tuscany, Italy",nan,nan
"Beaujolais, Beaujolais, France",46.1623511,4.7159424
"Saint-Joseph, Rhône Valley, France",nan,nan
"Recioto di Soave, Veneto, Italy",nan,nan
"Edna Valley, Central Coast, California, US",nan,nan
"Gavi, Piedmont, Italy",nan,nan
"Barossa Valley, South Australia, Australia",-34.581713199999996,138.99878719802487
"Columbia Valley (OR), Oregon Other, Oregon, US",nan,nan
"Contra Costa County, Central Coast, California, US",nan,nan
"Cerasuolo d'Abruzzo, Central Italy, Italy",nan,nan
"Val de Loire, Loire Valley, France",47.3907435,0.6944195
"Carneros, Napa-Sonoma, California, US",nan,nan
"Chassagne-Montrachet, Burgundy, France",nan,nan
"Blaye Côtes de Bordeaux, Bordeaux, France",nan,nan
"Fair Play, Sierra Foothills, California, US",nan,nan
"Hunter Valley, New South Wales, Australia",-32.5421803,151.2185641
"Monticello, Virginia, US",38.0103128,-78.452350594337
"Central Coast, Central Coast, California, US",37.7713304,-122.269181
"Los Carneros, Napa-Sonoma, California, US",nan,nan
"Washington, Washington Other, Washington, US",nan,nan
"Prosecco, Veneto, Italy",45.8991307,12.1004226
"Darling, South Africa",-33.376426,18.379189
"Buzet, Southwest France, France",nan,nan
"Cachapoal Valley, Chile",-34.1899333,-70.818402
"Cadillac Côtes de Bordeaux, Bordeaux, France",nan,nan
"Bolgheri, Tuscany, Italy",43.2340065,10.6179334
"Old Mission Peninsula, Michigan, US",44.9622232,-85.485356
"Cannonau di Sardegna, Sicily & Sardinia, Italy",nan,nan
"Snipes Mountain, Columbia Valley, Washington, US",nan,nan
"Los Chacayes, Mendoza Province, Argentina",-37.1814476,-70.6630724
"Moon Mountain District Sonoma County, Sonoma, California, US",nan,nan
"Haut-Judeé, Israel",nan,nan
"Toro, Northern Spain, Spain",nan,nan
"Santa Ynez Valley, Central Coast, California, US",nan,nan
"Sagrantino di Montefalco, Central Italy, Italy",nan,nan
"Vin de Pays d'Oc, Languedoc-Roussillon, France",nan,nan
"Nuits-St.-Georges, Burgundy, France",nan,nan
"Bierzo, Northern Spain, Spain",nan,nan
"Monterey, Central Coast, California, US",nan,nan
"Trebbiano d'Abruzzo, Central Italy, Italy",nan,nan
"Coteaux Varois en Provence, Provence, France",nan,nan
"Weinland Österreich, Austria",48.5504433,16.59889541379289
"Saint-Bris, Burgundy, France",nan,nan
"Western Cape, South Africa",-33.546977,20.72753
"Vino Nobile di Montepulciano, Tuscany, Italy",43.0716141,11.8054571
"Greco di Tufo, Southern Italy, Italy",nan,nan
"Central Valley, Chile",-41.2871537,174.7778477
"Roero, Piedmont, Italy",44.800313,7.828273
"Valpolicella Superiore Ripasso, Veneto, Italy",nan,nan
"Maule Valley, Chile",36.0628951,-115.2929631
"Idaho, Idaho, US",45.7680684,-115.5160723
"Bandol, Provence, France",43.1357717,5.7523647
"Elkton Oregon, Southern Oregon, Oregon, US",nan,nan
"St. Helena, Napa, California, US",38.5052288,-122.470042
"Bourgogne Côtes d’Auxerre, Burgundy, France",nan,nan
"Dealu Mare, Romania",46.7202291,23.1579285
"Montepulciano d'Abruzzo, Central Italy, Italy",nan,nan
"Seneca Lake, Finger Lakes, New York, US",nan,nan
"Soave Classico, Veneto, Italy",nan,nan
"Rosé d'Anjou, Loire Valley, France",nan,nan
"Tierra de Castilla, Central Spain, Spain",nan,nan
"Médoc, Bordeaux, France",44.7761268,-0.6517633127162602
"Menetou-Salon, Loire Valley, France",47.2315397,2.4886282
"Leithaberg, Austria",47.88822,16.5810037
"Gaillac, Southwest France, France",nan,nan
"Rogue Valley, Southern Oregon, Oregon, US",nan,nan
"Colorado, Colorado, US",39.579155,-104.8769227
"Casablanca Valley, Chile",-34.141794,18.8699888
"Saint-Chinian, Languedoc-Roussillon, France",nan,nan
"Puligny-Montrachet, Burgundy, France",nan,nan
"Spring Mountain District, Napa, California, US",nan,nan
"Montagne-Saint-Émilion, Bordeaux, France",nan,nan
"Margaux, Bordeaux, France",44.9119557,-0.682392
"Oakville, Napa, California, US",38.4368549,-122.4022007
"Leyda Valley, Chile",nan,nan
"Chambolle-Musigny, Burgundy, France",nan,nan
"Calaveras County, Sierra Foothills, California, US",nan,nan
"Côtes du Rhône Villages, Rhône Valley, France",nan,nan
"Diamond Mountain District, Napa, California, US",nan,nan
"Castillon Côtes de Bordeaux, Bordeaux, France",nan,nan
"Mount Barker, Western Australia, Australia",-34.6220807,117.6641727
"Côtes de Gascogne, Southwest France, France",nan,nan
"Waipara, New Zealand",-43.058482,172.7602403
"Colli Orientali del Friuli, Northeastern Italy, Italy",nan,nan
"South Styria, Austria",47.065556,15.4518867
"Collio, Northeastern Italy, Italy",nan,nan
"El Pomar District, Central Coast, California, US",nan,nan
"Bennett Valley, Sonoma, California, US",38.4254354,-122.6649553
"Carmel Valley, Central Coast, California, US",nan,nan
"Baden, Germany",48.1928371,8.1390286
"Sangiovese di Romagna, Central Italy, Italy",nan,nan
"El Dorado, Sierra Foothills, California, US",nan,nan
"Judean Hills, Israel",nan,nan
"Chevalier-Montrachet, Burgundy, France",nan,nan
"Idaho, US",43.6447642,-114.015407
"La Mancha, Central Spain, Spain",nan,nan
"Ribbon Ridge, Willamette Valley, Oregon, US",nan,nan
"Rosso di Montalcino, Tuscany, Italy",43.0543309,11.3648813
"Limarí Valley, Chile",-30.6418354,-71.2607304
"Jerez, Andalucia, Spain",36.6816936,-6.1377402
"San Gimignano, Tuscany, Italy",43.4677993,11.0432115
"Barbera d'Asti Superiore, Piedmont, Italy",nan,nan
"Conegliano Valdobbiadene Prosecco Superiore, Veneto, Italy",nan,nan
"Colli Tortonesi, Piedmont, Italy",nan,nan
"Yorkville Highlands, North Coast, California, US",nan,nan
"Long Island, Long Island, New York, US",40.7415095,-73.9569751
"Beaujolais-Villages, Beaujolais, France",nan,nan
"Lugana, Lombardy, Italy",45.4600534,10.6196897
"Valdeorras, Northern Spain, Spain",nan,nan
"Bendigo, Victoria, Australia",-36.7588767,144.2825931
"Patagonia, Other, Argentina",nan,nan
"Bairrada, Portugal",39.8672777,-8.4619293
"Savoie, France Other, France",nan,nan
"Mittelburgenland, Austria",47.504515999999995,16.49443025998506
"Corbières, Languedoc-Roussillon, France",nan,nan
"Cornas, Rhône Valley, France",nan,nan
"Templeton Gap District, Central Coast, California, US",nan,nan
"Jumilla, Levante, Spain",38.4740804,-1.3262211
"Pauillac, Bordeaux, France",44.7760032,-0.6511306341351732
"Negev Hills, Israel",30.9247487,34.7196507
"Saint-Véran, Burgundy, France",nan,nan
"Rutherglen, Victoria, Australia",-36.0538594,146.4601363
"Barbera d'Alba, Piedmont, Italy",nan,nan
"Donnici, Southern Italy, Italy",nan,nan
"Happy Canyon of Santa Barbara, Central Coast, California, US",nan,nan
"Terre di Chieti, Central Italy, Italy",nan,nan
"Yarra Valley, Victoria, Australia",-37.7835075,145.26012298170642
"Coteaux Varois, Provence, France",nan,nan
"New York, New York Other, New York, US",nan,nan
"San Antonio Valley, Central Coast, California, US",nan,nan
"Gard, Languedoc-Roussillon, France",43.8228184,4.3688296
"Nizza, Piedmont, Italy",nan,nan
"Cariñena, Northern Spain, Spain",nan,nan
"Österreichischer Sekt, Austria",nan,nan
"Pyrenees, Victoria, Australia",-37.3301195,143.42380230588194
"Crémant de Bourgogne, Burgundy, France",nan,nan
"Viré-Clessé, Burgundy, France",nan,nan
"Pouilly-Fuissé, Burgundy, France",nan,nan
"Cafayate, Other, Argentina",nan,nan
"Beira Atlantico, Portugal",-30.0709295,-50.1612492
"Pomino, Tuscany, Italy",43.8151012,11.5506357
"Luberon, Rhône Valley, France",nan,nan
"Côte de Brouilly, Beaujolais, France",46.0893824,4.6470174
"Tokaj, Hungary",48.1235534,21.4113895
"Bordeaux Rosé, Bordeaux, France",nan,nan
"Venezia Giulia, Northeastern Italy, Italy",nan,nan
"Côtes de Bordeaux, Bordeaux, France",44.7790343,-0.461452
"Olifants River, South Africa",-24.4763199,30.4730535
"Montello e Colli Asolani, Veneto, Italy",nan,nan
"Clements Hills, Central Valley, California, US",nan,nan
"Victoria, Victoria, Australia",-21.2309116,148.9741517
"Lamorinda, Central Coast, California, US",nan,nan
"Muscadet Sèvre et Maine, Loire Valley, France",nan,nan
"Monthélie, Burgundy, France",nan,nan
"Wrattonbully, South Australia, Australia",-37.1677831,140.9458691
"Dominio de Valdepusa, Central Spain, Spain",nan,nan
"Vacqueyras, Rhône Valley, France",nan,nan
"Régnié, Beaujolais, France",46.1259969,4.6338662
"Calistoga, Napa, California, US",38.5787966,-122.579705
"Valdepeñas, Central Spain, Spain",nan,nan
"Carnuntum, Austria",48.11096895,16.856701752148087
"Los Angeles County, South Coast, California, US",nan,nan
"Limestone Coast, South Australia, Australia",-36.966833,139.7525724
"Cochise County, Arizona, US",31.8514532,-109.8181858
"Clarksburg, Central Valley, California, US",nan,nan
"Tokaji, Hungary",48.1658637,21.381382426012586
"Adelaide Hills, South Australia, Australia",-34.901351649999995,138.8293202817461
"Mentrida, Central Spain, Spain",nan,nan
"High Valley, Lake County, California, US",39.0518681,-122.6883413
"Ballard Canyon, Central Coast, California, US",nan,nan
"Ribeira Sacra, Galicia, Spain",43.3244212,-8.4438723
"$20,Buy Now",nan,nan
"Columbia Valley-Walla Walla Valley, Columbia Valley, Washington, US",nan,nan
"Friuli Colli Orientali, Northeastern Italy, Italy",nan,nan
"Bourgueil, Loire Valley, France",47.2827691,0.1788873
"Meursault, Burgundy, France",nan,nan
"Beaumes-de-Venise, Rhône Valley, France",nan,nan
"Ventoux, Rhône Valley, France",nan,nan
"Fronton, Southwest France, France",nan,nan
"Vouvray, Loire Valley, France",47.4136687,0.7998446
"San Benito County, Central Coast, California, US",nan,nan
"Conero, Central Italy, Italy",nan,nan
"Saint-Julien, Bordeaux, France",44.792984,-0.5040716
"Amarone della Valpolicella, Veneto, Italy",nan,nan
"San Luis Obispo County, Central Coast, California, US",nan,nan
"Côtes du Marmandais, Southwest France, France",nan,nan
"Utiel-Requena, Levante, Spain",39.5229289,-1.1495788
"Tupungato, Mendoza Province, Argentina",-38.9694974,-68.0763723
"Côtes de Bourg, Bordeaux, France",nan,nan
"Central Otago, New Zealand",-45.1308846,169.63289538617886
"Coteaux Bourguignons, Burgundy, France",nan,nan
"Ribera del Guadiana, Central Spain, Spain",nan,nan
"Lalande de Pomerol, Bordeaux, France",nan,nan
"Corton, Burgundy, France",nan,nan
"Dolcetto d'Alba, Piedmont, Italy",nan,nan
"Texas Hill Country, Texas, US",29.476061,-98.7454365
"Costers del Segre, Catalonia, Spain",41.502298249999996,0.8273990115524253
"Vino de la Tierra de Castilla, Central Spain, Spain",nan,nan
"La Rioja, Other, Argentina",nan,nan
"Provincia di Pavia, Lombardy, Italy",45.036854649999995,9.137825082826026
"Cape South Coast, South Africa",-38.55963265,145.34333231093714
"Dogliani, Piedmont, Italy",nan,nan
"Coastal Region, South Africa",12.2571865,121.9907498
"Knights Valley, Sonoma, California, US",nan,nan
"Chehalem Mountains, Willamette Valley, Oregon, US",nan,nan
"Lambrusco Grasparossa di Castelvetro, Central Italy, Italy",nan,nan
"Côtes de Provence Sainte-Victoire, Provence, France",nan,nan
"Puglia, Southern Italy, Italy",nan,nan
"Maipú, Mendoza Province, Argentina",-38.8281404,-68.0662409
"Getariako Txakolina, Northern Spain, Spain",nan,nan
"Morellino di Scansano, Tuscany, Italy",42.712553650000004,11.228051603392505
"Marsannay, Burgundy, France",nan,nan
"Constantia, South Africa",-34.0230827,18.43672289993134
"Saint-Estèphe, Bordeaux, France",44.8973682,-0.58424555
"Chorey-lès-Beaune, Burgundy, France",nan,nan
"Abruzzo, Central Italy, Italy",nan,nan
"Uco Valley, Mendoza Province, Argentina",nan,nan
"Clare Valley, South Australia, Australia",-33.7890862,138.59055698355974
"Halkidiki, Greece",40.28948215,23.409392443373925
"Montepulciano d'Abruzzo Colline Teramane, Central Italy, Italy",nan,nan
"Marin County, North Coast, California, US",nan,nan
"Chianti, Tuscany, Italy",43.5824597,11.3168731
"Crozes-Hermitage, Rhône Valley, France",nan,nan
"Australia, Australia Other, Australia",nan,nan
"Rosso del Veronese, Veneto, Italy",nan,nan
"Albana di Romagna, Central Italy, Italy",nan,nan
"Galil, Israel",31.8928748,35.0202019
"Sable de Camargue, Languedoc-Roussillon, France",nan,nan
"Brouilly, Beaujolais, France",46.1134287,4.6432042
"Fiddletown, Sierra Foothills, California, US",nan,nan
"Elqui Valley, Chile",-29.9767491,-70.5530583
"Tumbarumba, New South Wales, Australia",-35.7764898,148.010062
"Trentino, Northeastern Italy, Italy",nan,nan
"Obidos, Portugal",39.3619514,-9.157153
"Isonzo del Friuli, Northeastern Italy, Italy",nan,nan
"Blanquette de Limoux, Languedoc-Roussillon, France",nan,nan
"Quincy, Loire Valley, France",47.133365,2.1574605
"Venezie, Northeastern Italy, Italy",nan,nan
"Adelaida District, Central Coast, California, US",nan,nan
"Recioto della Valpolicella Classico, Veneto, Italy",nan,nan
"Río Negro Valley, Other, Argentina",nan,nan
"Gavi di Gavi, Piedmont, Italy",nan,nan
"Malvasia delle Lipari, Sicily & Sardinia, Italy",nan,nan
"McLaren Vale-Padthaway, South Australia, Australia",nan,nan
"Yountville, Napa, California, US",38.4022008,-122.359506
"Pacherenc du Vic Bilh, Southwest France, France",nan,nan
"Francs Côtes de Bordeaux, Bordeaux, France",nan,nan
"South Coast, South Coast, California, US",33.691104949999996,-117.88857681399966
"Walker Bay, South Africa",-34.5563889,19.3416667
"Riverina, New South Wales, Australia",-35.0569397,147.4229787566404
"Moscato d'Asti, Piedmont, Italy",nan,nan
"Outer Coastal Plain, New Jersey, US",nan,nan
"Coteaux du Giennois, Loire Valley, France",47.6831795,2.6534443
"Prosecco di Conegliano, Veneto, Italy",nan,nan
"Chinon, Loire Valley, France",47.1667182,0.2402095
"Valtellina Superiore, Lombardy, Italy",nan,nan
"Santenay, Burgundy, France",nan,nan
"Veneto, Veneto, Italy",45.437878,10.7543423
"Mendoza Province, Argentina",-31.4049307,-58.0194721
"Palmela, Portugal",38.569601,-8.9011653
"Yolo County, Central Valley, California, US",nan,nan
"Vin Santo del Chianti Rufina, Tuscany, Italy",nan,nan
"Listrac-Médoc, Bordeaux, France",44.9133173,-0.6828554
"Upper Galilee, Israel",33.1944091,35.5681667
"Bergerac, Southwest France, France",nan,nan
"Paraje Altamira, Mendoza Province, Argentina",-34.7820998,-58.2603971
"Jonkershoek Valley, South Africa",nan,nan
"Temecula, South Coast, California, US",nan,nan
"Cayuga Lake, Finger Lakes, New York, US",nan,nan
"Saint-Péray, Rhône Valley, France",nan,nan
"Fronsac, Bordeaux, France",44.8424048,-0.799658
"Columbia Gorge (OR), Oregon Other, Oregon, US",nan,nan
"Irpinia, Southern Italy, Italy",nan,nan
"Côtes-du-Ventoux, Rhône Valley, France",nan,nan
"Bío Bío Valley, Chile",nan,nan
"Pirque, Chile",-33.6348808,-70.5729961
"Extremadura, Central Spain, Spain",41.7196477,-1.032899
"Saint-Nicolas-de-Bourgueil, Loire Valley, France",47.2843794,0.1256895
"Côtes du Roussillon, Languedoc-Roussillon, France",nan,nan
